show_id,type,title,director,cast,country,date_added,release_year,rating,duration,listed_in,description,description_es
s3818,TV Show,White Gold,,"Ed Westwick, James Buckley, Joe Thomas, Lauren O'Rourke, Linzey Cocker, Nigel Lindsay, Lloyd Hutchinson, Lee Ross",United Kingdom,"May 17, 2019",2019,TV-MA,2 Seasons,"British TV Shows, International TV Shows, TV Comedies","In 1980s Essex, cocky salesman Vincent Swan and his unscrupulous team will do anything to get the sale – including throwing honesty out the window.","En la década de 1980, Essex, el jugador de camarero Vincent Swan y su equipo sin escrúpulos harán cualquier cosa para obtener la venta, incluida la honestidad por la ventana."
s5256,Movie,Our Souls at Night,Ritesh Batra,"Robert Redford, Jane Fonda, Bruce Dern, Matthias Schoenaerts, Iain Armitage, Judy Greer, Phyllis Somerville",United States,"September 29, 2017",2017,TV-14,103 min,"Dramas, Romantic Movies","After widowed neighbors Addie and Louis begin sleeping in bed together platonically to alleviate their loneliness, a real romance begins to blossom.","Después de que los vecinos viudos Addie y Louis comienzan a dormir en la cama juntos platónicamente para aliviar su soledad, un verdadero romance comienza a florecer."
s2457,Movie,High Strung Free Dance,Michael Damian,"Juliet Doherty, Thomas Doherty, Jane Seymour, Harry Jarvis, Joshua Sinclair-Evans, Ace Bhatti, Desmond Richardson, Kika Markham","Romania, United States","May 31, 2020",2019,TV-14,104 min,"Dramas, Music & Musicals, Romantic Movies",A choreographer casts a contemporary dancer and a gifted pianist for a highly anticipated Broadway show as internal drama tries to steal the spotlight.,Un coreógrafo proyecta a un bailarín contemporáneo y un pianista talentoso para un espectáculo de Broadway muy esperado mientras el drama interno intenta robar el centro de atención.
s7992,TV Show,Shadow of Truth,,,Israel,"January 27, 2017",2016,TV-MA,1 Season,"Crime TV Shows, Docuseries, International TV Shows",This documentary series explores the explosive 2006 murder case of a 13-year-old Israeli girl and the subsequent conviction of a Ukrainian immigrant.,Esta serie documental explora el explosivo caso de asesinato de 2006 de una niña israelí de 13 años y la posterior condena de un inmigrante ucraniano.
s1254,Movie,LEGO Marvel Spider-Man: Vexed by Venom,"Andrew Duncan, Ken Cunningham","Robbie Daymond, Ben Pronsky, Josh Keaton, Tara Strong, Jennifer Hale, Laura Bailey",United States,"March 1, 2021",2019,TV-Y,22 min,"Children & Family Movies, Comedies","When Green Goblin and Venom team up for a disastrous scheme, Spider-Man calls in a wall-crawling ally and must rely on his Spidey senses to stop them.","Cuando Green Goblin y Venom se unen para un esquema desastroso, Spider-Man llama al aliado de la pared y debe confiar en sus sentidos de Spidey para detenerlos."
s5703,Movie,Rainbow Time,Linas Phillips,"Linas Phillips, Melanie Lynskey, Timm Sharp, Tobin Bell, Jay Duplass, Lauren Weedman, Artemis Pebdani, Reagan Yates, Austin Fryberger",United States,"December 1, 2016",2016,TV-MA,92 min,"Comedies, Dramas, Independent Movies","A developmentally disabled man obsessed with the Fonz, guns and all things kinky poses a challenge for his arrogant brother when he moves in with him.","Un hombre discapacitado en el desarrollo obsesionado con el Fonz, las armas y todas las cosas perjudicadas plantean un desafío para su hermano arrogante cuando se muda con él."
s7855,Movie,Remember Me,Allen Coulter,"Robert Pattinson, Emilie de Ravin, Chris Cooper, Lena Olin, Pierce Brosnan, Tate Ellington, Ruby Jerins, Gregory Jbara, Meghan Markle",United States,"August 1, 2020",2010,PG-13,112 min,"Dramas, Romantic Movies","Tyler's still feeling lost following the tragedy that's strained his relationship with his father when he meets Ally, a girl who understands his pain.","Tyler todavía se siente perdido después de la tragedia que ha tensado su relación con su padre cuando conoce a Ally, una niña que entiende su dolor."
s3972,TV Show,Ainori Love Wagon: Asian Journey,,"Becky, Audrey, Mayuko Kawakita, Shimon Okura",Japan,"March 28, 2019",2018,TV-MA,2 Seasons,"International TV Shows, Reality TV, Romantic TV Shows","Seven men and women board a pink bus in search of true love. On a journey through Asia with strangers, their goal is to return to Japan as a couple.","Siete hombres y mujeres abordan un autobús rosa en busca de amor verdadero.En un viaje por Asia con extraños, su objetivo es regresar a Japón como pareja."
s4241,Movie,Sam Kinison: The Scream Continues,,Sam Kinison,United States,"December 31, 2018",2016,TV-MA,29 min,Documentaries,Sam's brother and former manager Bill Kinison speaks about the late comedian's journey from preacher to standup legend.,"El hermano y el ex gerente de Sam, Bill Kinison, habla sobre el viaje del difunto comediante de predicador a leyenda de pie."
s3459,TV Show,Living Undocumented,,,United States,"October 2, 2019",2019,TV-MA,1 Season,Docuseries,Eight undocumented families' fates roller-coast as the United States' immigration policies are transformed.,Ocho Fates Roller-Coast de Festes de Familias indocumentadas a medida que se transforman las políticas de inmigración de los Estados Unidos.
s2830,Movie,Marc Maron: End Times Fun,Lynn Shelton,Marc Maron,United States,"March 10, 2020",2020,TV-MA,71 min,Stand-Up Comedy,"Marc Maron wades through a swamp of vitamin hustlers, evangelicals and grown male nerd children, culminating in a gleefully filthy end-times fantasy.","Marc Maron atraviesa un pantano de vitaminas Hustlers, evangélicos y niños nerd masculinos adultos, que culminan en una fantasía de los tiempos finales y alegremente sucios."
s8447,Movie,The Parole Officer,John Duigan,"Steve Coogan, Emma Gilmour, Susan Jane Tanner, Iain Mitchell, James Smith, Om Puri, Steven Waddington, Ben Miller, Lena Headey, Jenny Agutter",United Kingdom,"August 1, 2018",2001,R,94 min,"Action & Adventure, Comedies","After witnessing a murder, Simon Garden is framed – and the only evidence that proves his innocence is a videotape locked inside a bank vault.","Después de presenciar un asesinato, Simon Garden está enmarcado, y la única evidencia que demuestra su inocencia es una cinta de video encerrada dentro de una bóveda del banco."
s669,TV Show,Hap and Leonard,,"James Purefoy, Michael Kenneth Williams, Jimmi Simpson, Bill Sage, Christina Hendricks, Pollyanna McIntosh, Jeff Pope, Neil Sandilands, Henry G. Sanders, Enrique Murciano",United States,"June 19, 2021",2018,TV-MA,3 Seasons,"Crime TV Shows, TV Dramas","In late-1980s Texas, two best friends get involved in darkly comic misadventures by hiring themselves out to shady clients for illicit ends.","A finales de la década de 1980, Texas, dos mejores amigos se involucran en desventuras oscuramente cómicas al contratarse a clientes sospechosos para fines ilícitos."
s7811,TV Show,Queen of No Marriage,,"Ethan Juan, Cheryl Yang, Harry Chang, Sylvia Yang, James Wen, Patrick Lee",Taiwan,"August 1, 2016",2009,TV-MA,1 Season,"International TV Shows, Romantic TV Shows, TV Comedies",Sparks begin to fly when a successful 33-year-old single woman and a 25-year-old romantic with few prospects navigate love and differences.,Las chispas comienzan a volar cuando una exitosa mujer soltera de 33 años y una romántica de 25 años con pocas perspectivas navegan por el amor y las diferencias.
s18,TV Show,Falsa identidad,,"Luis Ernesto Franco, Camila Sodi, Sergio Goyri, Samadhi Zendejas, Eduardo Yáñez, Sonya Smith, Alejandro Camacho, Azela Robinson, Uriel del Toro, Géraldine Bazán, Gabriela Roel, Marcus Ornellas",Mexico,"September 22, 2021",2020,TV-MA,2 Seasons,"Crime TV Shows, Spanish-Language TV Shows, TV Dramas",Strangers Diego and Isabel flee their home in Mexico and pretend to be a married couple to escape his drug-dealing enemies and her abusive husband.,Extraños Diego e Isabel huyen de su casa en México y fingen ser una pareja casada para escapar de sus enemigos de consumo de drogas y su esposo abusivo.
s1079,Movie,Shiva: The Secret World Of Vedas City,Suhas Kadav,,,"April 13, 2021",2017,TV-Y,78 min,Children & Family Movies,"When the residents of Vedas are ordered to evacuate by a prince who claims the town as his own, young Shiva sets out to save the city and its citizens.","Cuando se ordena a los residentes de Vedas evacuar un príncipe que reclama la ciudad como suyo, la joven Shiva se propone salvar a la ciudad y a sus ciudadanos."
s4767,Movie,El club de los buenos infieles,,"Raúl Fernández, Fele Martínez, Juanma Cifuentes, Hovik Keuchkerian, Albert Ribalta, Jordi Vilches, Adrián Lastra, Raquel Salvador, Marta Brucart, Betsy Turnez",Spain,"July 19, 2018",2018,TV-MA,85 min,"Comedies, International Movies",Four childhood buddies in passionless marriages try a counterintuitive idea: a secret club for men who want to cheat – to regain lust for their wives.,Cuatro amigos de la infancia en matrimonios sin pasión prueban una idea contradictoria: un club secreto para hombres que quieren hacer trampa: recuperar la lujuria por sus esposas.
s5012,Movie,Schubert In Love,Lars Büchel,"Olaf Schubert, Mario Adorf, Marie Leuenberger, Jochen Barkas, Bert Stephan, Martina Hill, Christoph Jungmann, Luise Wolfram, Hildegard Schroedter, Imke Buchel",Germany,"March 1, 2018",2016,TV-14,94 min,"Comedies, International Movies","The last of his family line, Olaf Schubert doesn't have time for a girlfriend but dutifully searches for one when his father demands offspring.","La última de su línea familiar, Olaf Schubert, no tiene tiempo para una novia, sino que busca obedientemente una cuando su padre exige descendencia."
s4011,Movie,Jeff Dunham's Very Special Christmas Special,Michael Simon,"Jeff Dunham, Brian Haner",United States,"March 15, 2019",2008,TV-MA,85 min,Stand-Up Comedy,"Politically incorrect, sometimes raunchy ventriloquist Jeff Dunham is joined by his irreverent cast of characters in this hilarious Christmas special.","Políticamente incorrecto, a veces, el ventriloquista obsceno Jeff Dunham se une a su irreverente elenco de personajes en este hilarante especial de Navidad."
s749,TV Show,"Fresh, Fried & Crispy",,,United States,"June 9, 2021",2021,TV-PG,1 Season,Reality TV,"Passionate about food and ready for fun, critic Daym Drops drops in on America's smokin' hot spots for the best, freshest takes on fried food.","Apasionado por la comida y listo para la diversión, los críticos Daym Drops caen en los puntos calientes de Smokin 'Hot de Estados Unidos para las mejores y más frescas versiones de la comida frita."
s5242,Movie,Ghost Patrol,Karen J. Lloyd,"Scott McNeil, Vincent Tong, Travis Turner, Shannon Chan-Kent, Lili Beaudoin",Canada,"October 1, 2017",2016,TV-Y7,47 min,"Children & Family Movies, Comedies",Two kids and their pet dog (aka the Ghost Patrol) get a call about an old manor and soon find they are investigating their first real haunted house.,Dos niños y su perro mascota (también conocido como la Patrulla Ghost) reciben una llamada sobre una vieja mansión y pronto descubren que están investigando su primera casa embrujada real.
s3289,TV Show,Chief of Staff,,"Lee Jung-jae, Shin Mina, Lee Elijah, Kim Dong-jun, Jung Jin-young, Kim Kap-soo, Jung Woong-in, Im Won-hee, Kim Hong-pa",South Korea,"November 12, 2019",2019,TV-14,2 Seasons,"International TV Shows, Korean TV Shows, TV Dramas","As a chief of staff in the National Assembly, Jang Tae-jun influences power behind the scenes while pursuing his own ambitions to rise to the top.","Como jefe de gabinete de la Asamblea Nacional, Jang Tae-Jun influye en el poder detrás de escena mientras persigue sus propias ambiciones para llegar a la cima."
s4199,Movie,All of You,Dan Villegas,"Jennylyn Mercado, Derek Ramsay, Yayo Aguila, Kean Cipriano, Nico Antonio, Enzo Marcos, Via Antonio, Hannah Ladesma",Philippines,"January 11, 2019",2017,TV-MA,104 min,"Comedies, Dramas, International Movies","Two strangers meet on a dating app and experience instant chemistry, but their relationship unravels as jarring differences catch up to them.","Dos extraños se reúnen en una aplicación de citas y experimentan una química instantánea, pero su relación se desvanece cuando las diferencias discordantes les ponen al día."
s2442,Movie,What's Up?,Izidore K. Musallam,"Hisham Abdulrahman, Turki Al-Yusuf, Mais Hamdan, Khaled Sami, Mishal Al-Mutairi, Hind Muhamed","Saudi Arabia, United Arab Emirates","June 2, 2020",2006,TV-PG,95 min,"Comedies, Dramas, International Movies","Flirting with modernity, a young woman must keep her new romance a secret from her conservative brother, who plans to keep her in line with tradition.","Al coquetear con la modernidad, una mujer joven debe mantener a su nuevo romance en secreto de su hermano conservador, que planea mantenerla en línea con la tradición."
s4126,TV Show,The Last of the Schmucks,,"Chico, Ahmed Mekky, Hesham Maged, Bayoumi Fouad, Dina El-Sherbiny",Egypt,"February 7, 2019",2017,TV-MA,1 Season,"International TV Shows, TV Comedies","The year is 2041 and a dispute between a man and his wife has set the human race back. In this battle of the sexes, the primitive life isn't so simple.","El año es 2041 y una disputa entre un hombre y su esposa ha retrasado la raza humana.En esta batalla de los sexos, la vida primitiva no es tan simple."
s2958,Movie,Hum Aapke Hain Koun,Sooraj R. Barjatya,"Madhuri Dixit, Salman Khan, Mohnish Bahl, Renuka Shahane, Anupam Kher, Reema Lagoo, Alok Nath, Bindu",India,"February 1, 2020",1994,TV-14,193 min,"Classic Movies, Dramas, International Movies","Although Nisha falls for Prem, she agrees to marry his older brother for the good of their families. But fate may have other plans for the lovebirds.","Aunque Nisha se enamora de Prem, ella acepta casarse con su hermano mayor por el bien de sus familias.Pero el destino puede tener otros planes para los tortolitos."
s5943,Movie,A Stoning in Fulham County,Larry Elikann,"Ken Olin, Jill Eikenberry, Maureen Mueller, Gregg Henry, Nicholas Pryor, Noble Willingham, Peter Michael Goetz, Ron Perlman, Theodore Bikel, Olivia Burnette, Bill Allen, Brad Pitt",United States,"October 1, 2011",1988,TV-14,95 min,Dramas,"After reckless teens kill an Amish child, a prosecutor attempts to bring the youths to justice despite the condemnation he faces from the community.","Después de que los adolescentes imprudentes matan a un niño Amish, un fiscal intenta llevar a los jóvenes ante la justicia a pesar de la condena que enfrenta de la comunidad."
s4111,Movie,The Breaker Upperers,"Jackie van Beek, Madeleine Sami","Madeleine Sami, Jackie van Beek, James Rolleston, Celia Pacquola, Ana Scotney, Rima Te Wiata, Carl Bland, Brett O'Gorman, Cohen Holloway, Jemaine Clement",New Zealand,"February 15, 2019",2018,TV-MA,82 min,"Comedies, Independent Movies, International Movies","For the right price, BFFs Jen and Mel will ruthlessly end any romance. But when one of them grows a conscience, their friendship begins to unravel.","Por el precio correcto, BFFS Jen y Mel terminarán despiadadamente cualquier romance.Pero cuando uno de ellos crece una conciencia, su amistad comienza a desmoronarse."
s5104,TV Show,La Mante,,"Carole Bouquet, Fred Testot, Pascal Demolon, Manon Azem, Frédérique Bel, Élodie Navarre, Jacques Weber",France,"December 29, 2017",2017,TV-MA,1 Season,"Crime TV Shows, International TV Shows, TV Dramas","Decades after her capture, a serial killer offers to help solve a string of copycat murders – but only if her son, now a cop, will work by her side.","Décadas después de su captura, un asesino en serie ofrece ayudar a resolver una serie de asesinatos de imitación, pero solo si su hijo, ahora un policía, funcionará a su lado."
s8114,Movie,Suckseed,Chayanop Boonprakob,"Jirayu La-ongmanee, Pachara Chirathivat, Nattasha Nauljam, Thawat Pornrattanaprasert",Thailand,"September 5, 2018",2011,TV-MA,130 min,"Comedies, International Movies, Music & Musicals","When his boyhood crush Ern returns, Ped forms a band with his friend to impress her. Romantic rivalries bloom after the talented Ern joins the group.","Cuando su aplastamiento de la infancia, Ern regresa, PED forma una banda con su amiga para impresionarla.Las rivalidades románticas florecen después de que el talentoso Ern se une al grupo."
s6977,TV Show,History's Greatest Hoaxes,,,Australia,"July 12, 2019",2016,TV-PG,1 Season,"British TV Shows, Docuseries","Using previously unseen footage, this documentary series offers new insights into some of the biggest scams and forgeries in human history.","Usando imágenes previamente invisibles, esta serie documental ofrece nuevas ideas sobre algunas de las estafas y falsificaciones más grandes de la historia humana."
s3078,Movie,Aaviri,Ravi Babu,"Ravi Babu, Neha Chauhan, Sri Muktha, Bharani Shankar, Mukhtar Khan, Priya",India,"December 31, 2019",2019,TV-14,110 min,"Horror Movies, International Movies, Thrillers","After losing their first child in an accident, a couple moves to a palatial home, where their young daughter comes under the spell of an eerie spirit.","Después de perder a su primer hijo en un accidente, un par se muda a una casa palaciega, donde su pequeña hija viene bajo el hechizo de un espíritu misterioso."
s8335,TV Show,The Great Train Robbery,,"Luke Evans, Jim Broadbent, Paul Anderson, Martin Compston, Neil Maskell, Jack Roth, George Costigan, Robert Glenister, Nick Moran, Tim Pigott-Smith, James Fox, James Wilby, Jack Gordon, Nicholas Murchie, Del Synnott, Richard Hope, John Salthouse",United Kingdom,"March 31, 2017",2013,NR,1 Season,"British TV Shows, Crime TV Shows, International TV Shows","This two-part tale delivers the true story of the Great Train Robbery of 1963, the biggest one in England's history.","Esta historia de dos partes ofrece la verdadera historia del gran robo de trenes de 1963, el más grande en la historia de Inglaterra."
s5479,Movie,Laerte-se,"Lygia Barbosa da Silva, Eliane Brum",Laerte Coutinho,Brazil,"May 19, 2017",2017,TV-MA,101 min,"Documentaries, International Movies, LGBTQ Movies","After living as a man for nearly 60 years, Laerte Coutinho, one of Brazil's most brilliant cartoonists, introduces herself to the world as a woman.","Después de vivir como hombre durante casi 60 años, Latete Coutinho, uno de los dibujantes más brillantes de Brasil, se presenta al mundo como mujer."
s4631,Movie,Quincy,"Rashida Jones, Alan Hicks",Quincy Jones,United States,"September 21, 2018",2018,TV-MA,124 min,"Documentaries, Music & Musicals","This documentary profiles music and culture icon Quincy Jones, offering unprecedented access to his private life and stories from his unparalleled career.","Este documental perfila el ícono de la música y la cultura Quincy Jones, que ofrece acceso sin precedentes a su vida privada e historias de su carrera incomparable."
s1560,TV Show,The Mess You Leave Behind,,"Inma Cuesta, Bárbara Lennie, Tamar Novas, Arón Piper, Roberto Enríquez, Roque Ruíz, Isabel Garrido, Fede Pérez, Alfonso Agra, Susana Dans, Xavier Estévez, Xosé Antonio Touriñán, María Tasende, Camila Bossa, María Costas, Abril Zamora, Chelo Falcón, Ana Santos, Mela Casal, César Cambeiro",Spain,"December 11, 2020",2020,TV-MA,1 Season,"International TV Shows, Spanish-Language TV Shows, TV Dramas",A teacher starts her job at a high school but is haunted by a suspicious death that occurred there weeks before... and begins fearing for her own life.,"Una maestra comienza su trabajo en una escuela secundaria, pero está atormentada por una muerte sospechosa que ocurrió allí semanas antes ... y comienza a temer por su propia vida."
s719,Movie,Life of Crime,Daniel Schechter,"Jennifer Aniston, Mos Def, Isla Fisher, Will Forte, Mark Boone Junior, Tim Robbins, John Hawkes, Clea Lewis, Charlie Tahan, Kevin Corrigan",United States,"June 15, 2021",2013,R,101 min,"Comedies, Independent Movies","After two small-time crooks kidnap and ransom a rich businessman's wife, they discover a flaw in their plan: Her cheating husband doesn't want her back.","Después de dos pequeños delincuentes secuestrados y rescatar a la esposa de un rico hombre de negocios, descubren un defecto en su plan: su marido infiel no la quiere de regreso."
s8095,TV Show,Stone Age,,"Samantha Moon, Nancy Kim, Jacqueline Youn, Mike Yantzi, Anna Paik, Matt Anipen, Josh Schwartzentruber",South Korea,"July 1, 2019",2017,TV-Y7,1 Season,"Kids' TV, Korean TV Shows","Woody sets out to become the Stone Age's best animal trainer with a little help from his faithful pet dinosaur, Moga.","Woody se prepara para convertirse en el mejor entrenador de animales de la Edad de Piedra con un poco de ayuda de su fiel dinosaurio mascota, Moga."
s3979,Movie,Oversize Cops,"Chanon Yingyong, Phuwanit Pholdee","Sarun Cinsuvapala, Pramote Pathan, Suphachai Subprasert, Somyos Matures, Supavitch Nepremwattana, Nachjaree Horvejkul, Jatupone Chompoonich, Chertsak Pratumseesakhon",Thailand,"March 23, 2019",2017,TV-MA,100 min,"Action & Adventure, Comedies, International Movies","While investigating a bank robbery, a squad of overweight police officers undergoes rigorous training to shed pounds.","Mientras investiga un robo bancario, un escuadrón de policías con sobrepeso se somete a una rigurosa capacitación para arrojar libras."
s4608,Movie,Theeya Velai Seyyanum Kumaru,Sundar C.,"Siddarth, Santhanam, Hansika Motwani, Ganesh Venkatraman, RJ Balaji, Bosskey, Manobala, Chitra Lakshmanan",India,"October 1, 2018",2013,TV-PG,132 min,"Comedies, International Movies, Music & Musicals","When shy Kumar gets stuck on the losing end of a love triangle, the Love Doctor, Mokia, has a strategy for Kumar to win the love of his life.","Cuando el tímido Kumar se atasca en el extremo perdedor de un triángulo amoroso, el Doctor del Amor, Mokia, tiene una estrategia para que Kumar gane el amor de su vida."
s5423,TV Show,Pac-Man and the Ghostly Adventures,,"Erin Mathews, Sam Vincent, Andrea Libman, Ashleigh Ball, Ian James Corlett, Brian Drummond, Lee Tockar, Matt Hill","United States, Japan, Canada","June 20, 2017",2014,TV-Y7,2 Seasons,"Kids' TV, TV Comedies",Teenage Pac and his loyal crew face the ups and downs of adolescence while protecting Pac-World from a ghostly army led by the evil Betrayus.,La adolescente Pac y su leal tripulación enfrentan los altibajos de la adolescencia mientras protegen a Pac-World de un ejército fantasmal dirigido por el malvado traición.
s4020,Movie,Everything About Her,Joyce Bernal,"Angel Locsin, Xian Lim, Vilma Santos, Michael De Mesa, Nonie Buencamino, Khalil Ramos, Devon Seron, Alexa Ilacad, Nor Domingo, Robert Villar",Philippines,"March 14, 2019",2016,TV-MA,127 min,"Comedies, Dramas, International Movies",A hard-driving real estate tycoon who becomes ill with cancer hires a medical caretaker who helps her begin to mend fences with her estranged son.,Un magnate de bienes raíces que conduce duro que se enferma con cáncer contrata a un cuidador médico que la ayuda a comenzar a reparar las cercas con su hijo separado.
s6465,Movie,Chhota Bheem Kungfu Dhamaka,"Rajiv Chilaka, Binayak Das","Sonal Kaushal, Rupa Bhimani, Jigna Bharadhwaj, Sabina Malik, Julie Tejwani, Rajesh Kava, Vaibhav Thakkar, Samriddhi Shuklaa, Aditya Raj Sharma, Vinod Kulkarni",India,"August 15, 2019",2019,TV-Y7,112 min,Children & Family Movies,Chhota Bheem is in China for a martial arts competition but his real challenge: to save the emperor’s daughter from being kidnapped by the villain Zuhu!,"Chhota Bheem está en China para una competencia de artes marciales, pero su verdadero desafío: ¡salvar a la hija del emperador de ser secuestrada por el villano Zuhu!"
s170,Movie,Poseidon,Wolfgang Petersen,"Josh Lucas, Kurt Russell, Jacinda Barrett, Richard Dreyfuss, Emmy Rossum, Mía Maestro, Mike Vogel, Kevin Dillon, Freddy Rodríguez",United States,"September 1, 2021",2006,PG-13,98 min,"Action & Adventure, Dramas","A tidal wave spells disaster for a ship of New Year's Eve revelers when it capsizes the mammoth vessel, sending passengers into a battle for survival.","Una ola de marea explica un desastre para un barco de juerguistas de Nochevieja cuando volcea el gigantesco buque, enviando a los pasajeros a una batalla por la supervivencia."
s8020,Movie,Silicon Cowboys,Jason Cohen,,United States,"April 1, 2017",2016,TV-PG,77 min,Documentaries,"This documentary tells the story of Compaq Computer and its three founders, who in 1982, took on Goliath IBM at the height of its PC dominance.","Este documental cuenta la historia de Compaq Computer y sus tres fundadores, que en 1982 se enfrentaron a Goliath IBM en el apogeo de su dominio de PC."
s5345,Movie,Message from the King,Fabrice Du Welz,"Chadwick Boseman, Luke Evans, Teresa Palmer, Alfred Molina, Natalie Martinez, Tom Felton, Dale Dickey, Sibongile Mlambo","United Kingdom, France, Belgium, United States","August 4, 2017",2017,R,103 min,"Independent Movies, Thrillers","On a relentless quest to avenge his sister's murder, a man from Cape Town infiltrates a sprawling network of lowlifes and elites in Los Angeles.","En una implacable búsqueda para vengar el asesinato de su hermana, un hombre de Ciudad del Cabo se infiltra en una red de bajo volumen y élites en Los Ángeles."
s5742,TV Show,Trailer Park Boys: Out of the Park: Europe,,"Mike Smith, John Paul Tremblay, Robb Wells",Canada,"October 28, 2016",2016,TV-MA,1 Season,"International TV Shows, TV Comedies","The Trailer Park Boys are thrilled to get a free trip to Europe, until they arrive and learn about their corporate sponsor's unusual requirements.","Los chicos del parque de trailer están encantados de obtener un viaje gratuito a Europa, hasta que lleguen y aprendan sobre los requisitos inusuales de su patrocinador corporativo."
