show_id,type,title,director,cast,country,date_added,release_year,rating,duration,listed_in,description,description_es
s7497,Movie,Monster High: Ghouls Rule,"Mike Fetterly, Steve Sacks","Laura Bailey, Hank Banks, Cam Clarke, Erin Fitzgerald, Dee Dee Green, Kate Higgins, Andrew Duncan",United States,"March 1, 2018",2012,TV-Y7,71 min,Children & Family Movies,"After learning that monsters and ""Normies"" used to spend Halloween together, Frankie Stein and her pals rally both groups for a frightfully good time.","Después de enterarse de que los monstruos y las ""normas"" solían pasar Halloween juntos, Frankie Stein y sus amigos se unen a ambos grupos para pasar un buen rato terriblemente."
s6358,TV Show,Bondi Rescue,,"Andrew Günsberg, Dean Gladstone, Bruce Hopkins, Trent 'Maxi' Maxwell, Andrew Reid, Ryan Clark, Chris Chapman, Anthony 'Harries' Caroll",Australia," November 1, 2019",2016,TV-PG,1 Season,Reality TV,"This reality series follows elite professional lifeguards on Sydney's Bondi Beach, as they take on everything from animal stings to criminals.","Esta serie de realidad sigue a los socorristas profesionales de élite en la playa de Bondi de Sydney, ya que asumen todo, desde picaduras de animales hasta delincuentes."
s3571,Movie,Game Over (Telugu Version),Ashwin Saravanan,"Taapsee Pannu, Vinodhini, Parvathi T, Ramya Subramanian, Sanchana Natarajan, Anish Kuruvilla, David Solomon Raja",,"August 21, 2019",2019,TV-MA,98 min,"Horror Movies, International Movies, Thrillers","As a series of murders hit close to home, a video game designer with PTSD must confront her demons, or risk becoming their victim.","Como una serie de asesinatos golpeados cerca de casa, un diseñador de videojuegos con TEPT debe enfrentar a sus demonios o arriesgarse a convertirse en su víctima."
s2749,TV Show,Well-Intended Love,,"Xu Kaicheng, Simona Wang, Ian Yi, Huang Qian Shuo, Yang Hao Ming, Liu Jia Xi",China,"April 1, 2020",2020,TV-14,2 Seasons,"International TV Shows, Romantic TV Shows, TV Comedies","To secure a bone marrow donation, an actress diagnosed with leukemia makes a marriage pact with a young CEO – but love and secrets get in the way.","Para asegurar una donación de médula ósea, una actriz diagnosticada con leucemia hace un pacto matrimonial con un joven CEO, pero el amor y los secretos se interponen en el camino."
s4908,Movie,Candy Jar,Ben Shelton,"Christina Hendricks, Helen Hunt, Uzo Aduba, Sami Gayle, Jacob Latimore",United States,"April 27, 2018",2018,TV-14,93 min,"Children & Family Movies, Dramas, Romantic Movies",Dueling high school debate champs who are at odds on just about everything forge ahead with ambitious plans to get into the colleges of their dreams.,Los campeones de debate de la escuela secundaria en duelo que están en desacuerdo con casi todo lo que avanza con planes ambiciosos para ingresar a las universidades de sus sueños.
s3456,TV Show,Super Monsters,,"Elyse Maloway, Vincent Tong, Erin Matthews, Andrea Libman, Alessandro Juliani, Nicole Anthony, Ian James Corlett, Britt McKillip, Kathleen Barr, Diana Kaarina",,"October 4, 2019",2019,TV-Y,3 Seasons,Kids' TV,Preschool kids whose parents are the world's most famous monsters try to master their special powers while preparing for kindergarten.,Los niños preescolares cuyos padres son los monstruos más famosos del mundo tratan de dominar sus poderes especiales mientras se preparan para el jardín de infantes.
s1347,Movie,All My Friends Are Dead,Jan Belcl,"Julia Wieniawa-Narkiewicz, Mateusz Więcławek, Adam Graf Turczyk, Monika Krzywkowska, Nikodem Rozbicki, Kamil Piotrowski, Adam Bobik, Paulina Gałązka, Magdalena Perlińska, Katarzyna Chojnacka, Konrad Żygadło, Szymon Roszak, Michał Sikorski, Aleksandra Pisula, Wojciech Łozowski, Michał Meyer, Adam Woronowicz",Poland,"February 3, 2021",2020,TV-MA,97 min,"Comedies, Dramas, International Movies","A group of friends at a New Year’s Eve party go through a whirlwind of events that exposes secrets, breaks hearts — and leads to a shocking outcome.","Un grupo de amigos en una fiesta de Nochevieja pasa por un torbellino de eventos que expone secretos, rompe corazones y conduce a un resultado impactante."
s1220,Movie,You're Everything To Me,Tolga Örnek,"Tolga Çevik, Cengiz Bozkurt, Melis Birkan, Tuna Çevik",Turkey,"March 12, 2021",2016,TV-PG,107 min,"Comedies, Dramas, Independent Movies","When an old fling shows up with their infant child, a dallying man-child must take on the role of father and create a fairytale world for his daughter.","Cuando aparece una vieja aventura con su hijo pequeño, un hombre de hombre atrevido debe asumir el papel de padre y crear un mundo de cuento de hadas para su hija."
s7943,TV Show,Satrangi,,Deepali Sahay,,"April 1, 2017",2014,TV-PG,1 Season,"Docuseries, International TV Shows",Young musicians from 13 states in India demonstrate their cultural heritage by performing regional folk music using traditional instruments.,Jóvenes músicos de 13 estados de la India demuestran su patrimonio cultural al interpretar música popular regional utilizando instrumentos tradicionales.
s1373,Movie,June & Kopi,Noviandra Santosa,"Acha Septriasa, Ryan Delon, Makayla Rose Hilli, TJ",Indonesia,"January 28, 2021",2021,TV-PG,90 min,"Children & Family Movies, Dramas, International Movies","A street dog is taken in by a young couple, and the family pit becomes an instant accomplice as she adjusts to her new, loving home.","Una pareja joven acoge a un perro callejero, y el pozo familiar se convierte en un cómplice instantáneo mientras se adapta a su nuevo hogar amoroso."
s4383,Movie,Cam,Daniel Goldhaber,"Madeline Brewer, Patch Darragh, Melora Walters, Devin Druid, Imani Hakim, Michael Dempsey, Flora Diaz, Samantha Robinson, Jessica Parker Kennedy, Quei Tann",United States,"November 16, 2018",2018,TV-MA,95 min,"Horror Movies, Independent Movies, Thrillers","After a look-alike takes over her account, a cam girl with a growing fan base sets out to identify the mysterious culprit and reclaim her own identity.","Después de que un parecido se apodera de su relato, una chica Cam con una creciente base de fanáticos se propone identificar al misterioso culpable y reclamar su propia identidad."
s648,TV Show,The Parisian Agency: Exclusive Properties,,"Olivier Kretz, Sandrine Kretz, Valentin Kretz, Martin Kretz, Louis Kretz",,"June 23, 2021",2021,TV-G,1 Season,"International TV Shows, Reality TV",This reality series follows the Kretz family and their luxury property business as they help clients buy and sell fabulous homes in France and abroad.,Esta serie de realidad sigue a la familia Kretz y su negocio inmobiliario de lujo mientras ayudan a los clientes a comprar y vender casas fabulosas en Francia y en el extranjero.
s7039,Movie,I Am Maris,Laura VanZee Taylor,Maris Degener,United States,"April 1, 2019",2018,TV-14,54 min,Documentaries,"Through her own words and art, a young woman details the healing power of yoga in her struggle with anorexia and her journey to self-acceptance.","A través de sus propias palabras y arte, una joven detalla el poder curativo del yoga en su lucha con la anorexia y su viaje hacia la autoaceptación."
s6659,TV Show,Earth to Luna!,,"Angelina Carballo, Raul-Gomez Pina, Eric Anderson",Brazil,"April 10, 2020",2014,TV-Y,1 Season,Kids' TV,"Curious about everything and excited about science, 6-year-old Luna, her brother Jupiter and pet Clyde explore nature to learn about the world.","Curioso por todo y entusiasmados con la ciencia, Luna, de 6 años, su hermano Júpiter y Pet Clyde exploran la naturaleza para aprender sobre el mundo."
s5575,Movie,One 2 Ka 4,Shashilal K. Nair,"Shah Rukh Khan, Juhi Chawla, Jackie Shroff, Nirmal Pandey, Dilip Joshi, Sahila Chaddha, Suresh Chatwal, Bharat Dabholkar, Baby Gazala, Akash Khurana",India,"March 15, 2017",2001,TV-14,160 min,"Action & Adventure, Comedies, Dramas","When his partner is killed, a young cop is forced to care for the man's four children, and solicits the help of a woman who moves in with them.","Cuando mata a su pareja, un policía joven se ve obligado a cuidar a los cuatro hijos del hombre y solicita la ayuda de una mujer que se muda con ellos."
s2288,Movie,Queen,Vikas Bahl,"Kangana Ranaut, Rajkummar Rao, Lisa Haydon, Mish Boyko, Jeffrey Chee Eng Ho, Marco Canadea, Sabeeka Imam, Yogendra Tikku",India,"July 5, 2020",2014,TV-MA,138 min,"Comedies, Dramas, International Movies","Dumped by her fiancé, a sheltered young woman decides to go on her honeymoon to Europe alone, embarking on an exhilarating journey of self-discovery.","Dejada por su prometido, una joven protegida decide ir a su luna de miel a Europa sola, embarcando en un emocionante viaje de autodescubrimiento."
s6825,TV Show,Game Winning Hit,,"Lego Lee, Alice Ko, Afalean Lu, Tsai Chen-nan, Wang Chuan, Leiya Gao, Charlize Lin",Taiwan,"September 1, 2016",2009,TV-MA,1 Season,"International TV Shows, TV Comedies, TV Dramas",An army deserter hiding out in a small coastal town becomes the coach of a youth baseball team and develops warm relationships in his new community.,Un desertor del ejército que se esconde en una pequeña ciudad costera se convierte en el entrenador de un equipo de béisbol juvenil y desarrolla relaciones cálidas en su nueva comunidad.
s3482,TV Show,Bard of Blood,,"Emraan Hashmi, Viineet Kumar, Sobhita Dhulipala, Jaideep Ahlawat, Kirti Kulhari, Sohum Shah, Rajit Kapoor, Danish Hussain",India,"September 27, 2019",2019,TV-MA,1 Season,"International TV Shows, TV Action & Adventure, TV Dramas","Years after a disastrous job in Balochistan, a former Indian spy must confront his past when he returns to lead an unsanctioned hostage-rescue mission.","Años después de un trabajo desastroso en Baluchistán, un ex espía indio debe enfrentar su pasado cuando regrese para liderar una misión no autorizada de rescate de rehenes."
s5937,Movie,Shrek the Musical,Jason Moore,"Brian d'Arcy James, Daniel Breaker, Sutton Foster, Christopher Sieber, John Tartaglia, Rozi Baker, Ryan Duncan, Leah Greenhaus, Chris Hoch, Marissa O'Donnell, Denny Paschall",United States,"December 29, 2013",2013,TV-G,130 min,"Children & Family Movies, Comedies, Music & Musicals","The greatest fairy tale never told comes to life in this colorful, song-filled, Tony Award-winning Broadway production based on the hit movie.","El mejor cuento de hadas que nunca contó cobra vida en esta colorida producción de Broadway, galardonada y galardonada con Tony, basada en la exitosa película."
s3961,Movie,The Burial of Kojo,"Sam ""Blitz"" Bazawule","Cynthia Dankwa, Ama K. Abebrese, Joseph Otsiman, Kobina Amissah Sam, Mamley Djangmah, Henry Adofo, Anima Misa, Brian Angels","Ghana, United States","March 31, 2019",2018,TV-14,81 min,"Dramas, Independent Movies, International Movies","When a man is left to die inside an illegal gold mine, his daughter travels through a magical landscape to save him.","Cuando se deja morir a un hombre dentro de una mina de oro ilegal, su hija viaja a través de un paisaje mágico para salvarlo."
s5767,TV Show,Fall in Love with Me,,"Aaron Yan, Tia Lee, Jack Lee, Katherine Wang, Beatrice Fang, Vince Kao, Chen Bor Jeng",Taiwan,"October 1, 2016",2014,TV-14,1 Season,"International TV Shows, Romantic TV Shows, TV Comedies",The head of a struggling ad agency finds herself torn between a hotshot executive and a kind stranger – not realizing they're the same person.,"El jefe de una agencia publicitaria en dificultades se encuentra dividida entre un ejecutivo de Hotshot y un amable extraño, sin darse cuenta de que son la misma persona."
s8145,Movie,Taal,Subhash Ghai,"Anil Kapoor, Aishwarya Rai Bachchan, Akshaye Khanna, Amrish Puri, Alok Nath, Mita Vasisht, Saurabh Shukla, Supriya Karnik",India,"March 1, 2018",1999,TV-PG,177 min,"Dramas, International Movies, Music & Musicals","Businessman Manav falls for aspiring singer Mansi, but their romance faces an uphill climb when Manav must depart and Mansi's suave manager moves in.","El empresario Manav se enamora del aspirante a cantante Mansi, pero su romance enfrenta una subida cuesta arriba cuando Manav debe partir y el suave gerente de Mansi se mude."
s4861,Movie,Aiyaary,Neeraj Pandey,"Sidharth Malhotra, Manoj Bajpayee, Rakul Preet Singh, Pooja Chopra, Adil Hussain, Kumud Mishra, Naseeruddin Shah, Anupam Kher, Vikram Gokhale, Juhi Babbar",India,"May 15, 2018",2018,TV-MA,158 min,"Action & Adventure, Dramas, International Movies","When his protégé goes rogue and poses a grave threat to the government he serves, a veteran officer of the Indian Army tries to stop him at all costs.","Cuando su protegido se vuelve deshonesto y representa una grave amenaza para el gobierno al que sirve, un oficial veterano del ejército indio intenta detenerlo a toda costa."
s2922,TV Show,Narcos: Mexico,,"Michael Peña, Diego Luna, Tenoch Huerta, Joaquin Cosio, José María Yazpik, Matt Letscher, Alyssa Diaz","Mexico, United States","February 13, 2020",2020,TV-MA,2 Seasons,"Crime TV Shows, TV Action & Adventure, TV Dramas","Witness the birth of the Mexican drug war in the 1980s as a gritty new ""Narcos"" saga chronicles the true story of the Guadalajara cartel's ascent.","Sea testigo del nacimiento de la guerra de drogas mexicana en la década de 1980 como una nueva saga arenosa de ""narcos"" narra la verdadera historia del ascenso del cartel de Guadalajara."
s6826,TV Show,Gangs of Hassepur,,"Ragini Khanna, Mandira Bedi, Tanishaa Mukerji",India,"April 15, 2017",2014,TV-PG,1 Season,"International TV Shows, Stand-Up Comedy & Talk Shows, TV Comedies","Training a keen eye on hot-button political topics, this variety show features stand-up comedy, sketches and sarcastic celebrity impersonations.","Entrenando a un buen ojo sobre los temas políticos de hot-button, este programa de variedades presenta una comedia de pie, bocetos y suplantaciones sarcásticas de celebridades."
s7986,Movie,Set Up,Mike Gunther,"50 Cent, Ryan Phillippe, Bruce Willis, Rory Markham, Jenna Dewan, Brett Granstaff, Randy Couture, Susie Abromeit, Ron Turner, James Remar",United States,"January 10, 2020",2011,R,85 min,Action & Adventure,"A diamond heist goes horribly wrong, and the group of friends who sought to make a fortune must instead fight for their very survival.","Un atraco de diamantes se vuelve terriblemente mal, y el grupo de amigos que intentaron hacer una fortuna debe luchar por su propia supervivencia."
s5263,TV Show,Terrace House: Aloha State,,"You, Reina Triendl, Ryota Yamasato, Yoshimi Tokui, Azusa Babazono, Kentaro","United States, Japan","September 26, 2017",2017,TV-14,4 Seasons,"International TV Shows, Reality TV","The beautiful island of Oahu is host to a new batch of six strangers who share a single roof, multiple conflicts and no script in this reality series.","La hermosa isla de Oahu es anfitriona de un nuevo lote de seis extraños que comparten un solo techo, múltiples conflictos y ningún guión en esta serie de realidad."
s5007,Movie,Battle Drone,Mitch Gould,"Louis Mandylor, Daniel Southworth, Richard Alan Reid, Oleg Taktarov, Natassia Malthe, Jason Earles, Dominique Swain, Michael Paré",United States,"March 1, 2018",2018,TV-MA,94 min,"Action & Adventure, Independent Movies, Sci-Fi & Fantasy","A team of mercenaries working with the CIA accepts an off-the-books mission in Chernobyl, where deadly human-controlled droids prepare an ambush.","Un equipo de mercenarios que trabajan con la CIA acepta una misión fuera de los libros en Chernobyl, donde los droides mortales controlados por humanos preparan una emboscada."
s3579,TV Show,Diagnosis,,Lisa Sanders,United States,"August 16, 2019",2019,TV-14,1 Season,"Docuseries, Science & Nature TV",Dr. Lisa Sanders crowdsources diagnoses for mysterious and rare medical conditions in a documentary series based on her New York Times Magazine column.,La Dra. Lisa Sanders Crowdsources Diagnostices para condiciones médicas misteriosas y raras en una serie documental basada en su columna de la revista New York Times.
s5563,TV Show,Dave Chappelle,Stan Lathan,Dave Chappelle,United States,"March 21, 2017",2017,TV-MA,1 Season,"Stand-Up Comedy & Talk Shows, TV Comedies","Comedy icon Dave Chappelle makes his triumphant return to the screen with a pair of blistering, fresh stand-up specials.",El ícono de la comedia Dave Chappelle hace que su triunfante regrese a la pantalla con un par de especiales de pie frescos y abrasadores.
s8235,Movie,The Cakemaker,Ofir Raul Graizer,"Sarah Adler, Tim Kalkhof, Roy Miller, Zohar Shtrauss, Sandra Sade, Tamir Ben-Yehuda, Stephanie Stremler, Tagel Eliyahu","Israel, Germany","December 4, 2018",2017,TV-14,109 min,"Dramas, Independent Movies, International Movies","When a German baker travels to Jerusalem in search of his dead male lover’s family, his growing involvement with them may expose his truth.","Cuando un panadero alemán viaja a Jerusalén en busca de la familia de su amante masculino muerto, su creciente participación con ellos puede exponer su verdad."
s1618,Movie,Natalie Palamides: Nate - A One Man Show,Phil Burgers,Natalie Palamides,United States,"December 1, 2020",2020,TV-MA,60 min,Comedies,"Tough talk takes a soft turn as Nate, played by comedian Natalie Palamides, explores humor, heartbreak, sexuality and consent — with a live audience.","Tough Talk toma un giro suave como Nate, interpretado por la comediante Natalie Palamides, explora el humor, la angustia, la sexualidad y el consentimiento, con una audiencia en vivo."
s1609,Movie,3 Days to Kill,McG,"Kevin Costner, Amber Heard, Hailee Steinfeld, Connie Nielsen, Tómas Lemarquis, Richard Sammel, Marc Andréoni, Bruno Ricci, Jonas Bloquet, Eriq Ebouaney","United States, France, Serbia","December 1, 2020",2014,PG-13,117 min,Action & Adventure,A terminally ill secret agent accepts a risky mission in exchange for an experimental drug that might save him – if he can survive its side effects.,"Un agente secreto terminal acepta una misión arriesgada a cambio de un medicamento experimental que podría salvarlo, si puede sobrevivir a sus efectos secundarios."
s6746,Movie,Feel Rich,Peter Spirer,"Quincy Jones, Common, Russell Simmons, Fat Joe, Paul Wall, Quincy Jones III",United States,"August 23, 2017",2017,TV-MA,70 min,Documentaries,"Talking squarely to the hip-hop generation, musicians, athletes and others outline the benefits of exercise, a healthy diet and spiritual wellness.","Hablando directamente con la generación de hip-hop, los músicos, los atletas y otros describen los beneficios del ejercicio, una dieta saludable y bienestar espiritual."
s8691,TV Show,Wake Up,,"Jag Huang, Chris Wu, Tiffany Hsu, Michael Huang, Lego Li, Summer Meng",,"March 31, 2018",2017,TV-14,2 Seasons,"International TV Shows, TV Dramas","After taking the blame for a patient death, an anesthesiologist battling psychiatric trauma fights to stay afloat in the corrupt hospital system.","Después de tomar la culpa de una muerte al paciente, un anestesiólogo que lucha contra el trauma psiquiátrico lucha por mantenerse a flote en el sistema hospitalario corrupto."
s1996,Movie,The Devil All The Time,Antonio Campos,"Tom Holland, Bill Skarsgård, Riley Keough, Robert Pattinson, Mia Wasikowska, Jason Clarke, Sebastian Stan, Haley Bennett, Harry Melling, Eliza Scanlen",United States,"September 16, 2020",2020,R,139 min,"Dramas, Thrillers",Sinister characters converge around a young man devoted to protecting those he loves in a postwar backwoods town teeming with corruption and brutality.,Los personajes siniestros convergen alrededor de un joven dedicado a proteger a aquellos que aman en una ciudad de posguerra repleta de corrupción y brutalidad.
s6537,Movie,Coraline,Henry Selick,"Dakota Fanning, Teri Hatcher, John Hodgman, Jennifer Saunders, Dawn French, Keith David, Robert Bailey Jr., Ian McShane",United States,"March 16, 2017",2009,PG,101 min,Children & Family Movies,Curious young Coraline unlocks a door in her family's home and is transported to a universe that strangely resembles her own – only better.,"La curiosa joven Coraline desbloquea una puerta en la casa de su familia y es transportada a un universo que extrañamente se parece a la suya, solo mejor."
s7815,Movie,R.L. Stine's Mostly Ghostly,Richard Correll,"Madison Pettis, Sterling Beaumon, Luke Benward, Brian Stepanek, David DeLuise, Kim Rhodes, Adam Hicks, Ali Lohan, Sabrina Bryan, Rachel Winfree, Diego Acuña",United States,"August 1, 2018",2008,PG,98 min,"Children & Family Movies, Comedies","After discovering a pair of young ghosts, a nebbish 11-year-old agrees to help the sibling spirits solve the mystery surrounding their demise.","Después de descubrir un par de jóvenes fantasmas, un niño de 11 años de neblina acepta ayudar a los espíritus hermanos a resolver el misterio que rodea su fallecimiento."
s2273,Movie,Drishyam,Nishikant Kamat,"Ajay Devgn, Shriya Saran, Tabu, Rajat Kapoor, Ishita Dutta, Mrunal Jadhav, Prasanna Ketkar, Yogesh Sonam, Prathamesh Parab, Rishabh Chaddha",India,"July 5, 2020",2015,TV-14,162 min,"Dramas, International Movies, Thrillers",An unexceptional man becomes a murder suspect when the son of a high-ranking police official who harassed his daughter goes missing.,Un hombre excepcional se convierte en un sospechoso de asesinato cuando el hijo de un oficial de policía de alto rango que acosó a su hija desaparece.
s316,Movie,Ije: The Journey,Chineze Anyaene,"Genevieve Nnaji, Omotola Jalade-Ekeinde, Odalys Garcia, Ulrich Que, Jeff Swarthout, Clem Ohameze, Ann D. Carey, Anahit Setian, Danielle Soibelman, Jon Morgan Woodward","United States, Nigeria","August 3, 2021",2010,TV-MA,106 min,"Dramas, International Movies","When her sister is accused of multiple murders, a Nigerian woman travels to Los Angeles to uncover the truth and fight for her sibling’s freedom.","Cuando su hermana está acusada de múltiples asesinatos, una mujer nigeriana viaja a Los Ángeles para descubrir la verdad y luchar por la libertad de su hermano."
s4271,TV Show,LAST HOPE,,"Tomoaki Maeno, Kana Hanazawa, Kenjiro Tsuda, Nao Toyama, Yuma Uchida, Unsho Ishizuka, Yuuichirou Umehara, Ai Kayano",Japan,"December 21, 2018",2018,TV-14,2 Seasons,"Anime Series, International TV Shows","After causing the near extinction of mankind seven years ago, genius scientist Leon Lau must now fight the ecological disaster he unwittingly created.","Después de causar la casi extinción de la humanidad hace siete años, el genio científico Leon Lau ahora debe luchar contra el desastre ecológico que involuntariamente creó."
s15,TV Show,Crime Stories: India Detectives,,,,"September 22, 2021",2021,TV-MA,1 Season,"British TV Shows, Crime TV Shows, Docuseries",Cameras following Bengaluru police on the job offer a rare glimpse into the complex and challenging inner workings of four major crime investigations.,Las cámaras después de la policía de Bengaluru en el trabajo ofrecen una rara visión del funcionamiento interno complejo y desafiante de cuatro investigaciones de delitos importantes.
s4864,Movie,Ali Wong: Hard Knock Wife,Jay Karas,Ali Wong,United States,"May 13, 2018",2018,TV-MA,64 min,Stand-Up Comedy,"Two years after the hit ""Baby Cobra,"" Ali Wong is back with another baby bump – and a torrent of hilarious truths about marriage and motherhood.","Dos años después del éxito ""Baby Cobra"", Ali Wong ha vuelto con otro bulto de bebé, y un torrente de verdades hilarantes sobre el matrimonio y la maternidad."
s8255,Movie,The Congress,Ari Folman,"Robin Wright, Harvey Keitel, Jon Hamm, Paul Giamatti, Kodi Smit-McPhee, Danny Huston, Sami Gayle, Michael Stahl-David, Michael Landes, Sarah Shahi","Israel, Germany, Poland, Luxembourg, Belgium, France, United States","August 23, 2019",2013,TV-MA,123 min,"Dramas, International Movies, Sci-Fi & Fantasy",Actress Robin Wright plays herself in this surreal drama about a film star who agrees to have her digital image recorded for reuse in future films.,La actriz Robin Wright se interpreta en este drama surrealista sobre una estrella de cine que acepta que su imagen digital grabada para reutilizar en futuras películas.
s5269,Movie,Jerry Before Seinfeld,Michael Bonfiglio,Jerry Seinfeld,United States,"September 19, 2017",2017,TV-14,62 min,Stand-Up Comedy,"Jerry Seinfeld returns to the club that gave him his start in the 1970s, mixing iconic jokes with stories from his childhood and early days in comedy.","Jerry Seinfeld regresa al club que le dio su comienzo en la década de 1970, mezclando bromas icónicas con historias de su infancia y los primeros días en la comedia."
s2719,TV Show,Community,,"Ken Jeong, Jim Rash, Donald Glover, Joel McHale, Gillian Jacobs, Danny Pudi, Alison Brie, Chevy Chase, Yvette Nicole Brown",United States,"April 1, 2020",2015,TV-14,6 Seasons,TV Comedies,"When his degree is found bogus, lawyer Jeff Winger is sent back to college, where he meets students and teachers with credentials as dubious as his.","Cuando su título se encuentra falso, el abogado Jeff Winger es enviado de regreso a la universidad, donde conoce a estudiantes y maestros con credenciales tan dudosas como la suya."
s6477,Movie,Christian Mingle,Corbin Bernsen,"Lacey Chabert, Jonathan Patrick Moore, Saidah Arrika Ekulona, Stephen Tobolowsky, John O'Hurley, David Keith, Morgan Fairchild, Corbin Bernsen",United States,"June 6, 2019",2014,PG,99 min,"Comedies, Faith & Spirituality, Romantic Movies",A career woman who has everything but romance finds her values challenged when she starts dating a good man she met on a Christian matchmaking site.,Una mujer de carrera que tiene todo menos el romance encuentra sus valores desafiados cuando comienza a salir con un buen hombre que conoció en un sitio de emparejamiento cristiano.
